CommentId,VideoId,Text,IsToxic,text_procesado
UgztQfNqz2zUnZYpUZJ4AaABAg,cT14IbTDW2c,Signs saying black lives matter and they are blocking black and white people. wtf?,True,sign saying black life matter blocking black white people wtf
UgzTz5Oub5ioq6ODC914AaABAg,cT14IbTDW2c,Should have dealt with them with force,False,dealt force
UgzW7M99erZM-ouQ0yV4AaABAg,cT14IbTDW2c,Drive through them,True,drive
UgzWOM1fvgg5rw_W1XB4AaABAg,cT14IbTDW2c,Stupid American,True,stupid american
UgzwrS37qzfArRXP80p4AaABAg,cT14IbTDW2c,If it was me I would have just kept going if you get hit you get hit I'd slowly push my way through ppl  who did that need to grow the fuck up,True,would kept going get hit get hit id slowly push way ppl need grow fuck
Ugzxit7UlcE33xXThIt4AaABAg,cT14IbTDW2c,It should be a law if there a protesters blocking the street you should be leagaly allowed to run them over,True,law protester blocking street leagaly allowed run
UgzXPP-nnSNB9qnH7zh4AaABAg,cT14IbTDW2c,pepper spray the cunts. They will run.,True,pepper spray cunt run
UgzYz6sKfL9eDiVZ1DR4AaABAg,cT14IbTDW2c,Bunch of pussies who have nothing better to do than to cry about problems that are only escalated because they do stupid shit like this,True,bunch pussy nothing better cry problem escalated stupid shit like
Ugg_G6d9ehvFo3gCoAEC,dDbRyFIkNII,I'm not informed 100% about what exactly is going on but that was fucked up! I'm trying to find reliable resources to understand this. I can't believe that it is 2014 and thing like this is still happening.,False,im informed exactly going fucked im trying find reliable resource understand cant believe thing like still happening
UghAbXMwBZQ043gCoAEC,dDbRyFIkNII,the people in ferguson have to loot! the oly thing the goverment cares about is the economy! fuck it up n they will make an effort to stop crooked cops!,True,people ferguson loot oly thing goverment care economy fuck n make effort stop crooked cop
UghmIbTYT8V0Y3gCoAEC,dDbRyFIkNII,good quality !,False,good quality
Ugi-AutQK-PGmHgCoAEC,dDbRyFIkNII,Wow...........,False,wow
Ugj4CNrg0w8ufngCoAEC,dDbRyFIkNII,Welcome to New World Order.,True,welcome new world order
Ugj-DZyJ6rJBOXgCoAEC,dDbRyFIkNII,"Who the hell cares if there are  people peacefully protesting? If the police feels threatened they are gonna act. I say, blow them fuckers in the face with some tg. That is what follows a riot.",True,hell care people peacefully protesting police feel threatened gonna act say blow fucker face tg follows riot
Ugw5-xcVE7UQ-Su23j94AaABAg,dDbRyFIkNII,I want to toss one of those gernades lol not at anyone of course but at a range that would be the fucking shit,True,want toss one gernades lol anyone course range would fucking shit
UgwXBmS_l1k2AHONWTd4AaABAg,dDbRyFIkNII,"Ah... memories.
Btw, you brought the fireworks.",False,ah memory btw brought firework
Ugyq7vvHf_dWdP8HIAB4AaABAg,dDbRyFIkNII,Stuff like this is one of the reasons why people associate violence and danger with black people.,True,stuff like one reason people associate violence danger black people
UgzaLrs8IAzhKyib03F4AaABAg,dDbRyFIkNII,That was awesome,False,awesome
Ugg_tHGB8ZFbpXgCoAEC,dG7mZQvaQDk,"I love this lady!!!

We need more strong women like Peggy Hubbard!!",False,love lady need strong woman like peggy hubbard
Ugg06ovk58usR3gCoAEC,dG7mZQvaQDk,"Peggy, Im a Native american, and I LOVE YOU HONEY",False,peggy im native american love honey
Ugg0vtBhu5PCu3gCoAEC,dG7mZQvaQDk,Huge wisdom here for anyone that has ears to listen.,False,huge wisdom anyone ear listen
Ugg2DE0cw-u_DXgCoAEC,dG7mZQvaQDk,Mrs. Hubbard . . . you get it .. Jamyla Bolden died so needlessly ..,False,mr hubbard get jamyla bolden died needlessly
Ugg9Nkij19Uts3gCoAEC,dG7mZQvaQDk,Amen Amen sister you go you strong black woman i got your back,False,amen amen sister go strong black woman got back
UggAljyL41lywHgCoAEC,dG7mZQvaQDk,A Stand Up Woman speaking the Truth. I applaud You... You have more guts then most Young Lady.,False,stand woman speaking truth applaud gut young lady
UggBE-midsOcxXgCoAEC,dG7mZQvaQDk,Peggy: you are blessed with so much courage & heart!! Thank you for your honesty & passion in this matter! #whatawoman,False,peggy blessed much courage heart thank honesty passion matter whatawoman
UggFa6gKjS21nHgCoAEC,dG7mZQvaQDk,This Lady should be the first guest speaker at all of Al Sharpton’s rallies.  Seriously,False,lady first guest speaker al sharptons rally seriously
UggfMgHywO3pmHgCoAEC,dG7mZQvaQDk,I love this woman. THIS is a voice that matters. Fuck black lives matter.,True,love woman voice matter fuck black life matter
UggIk5feB00KE3gCoAEC,dG7mZQvaQDk,"Thats a real parent, a real mother. Nothing but real talk right there. She learned well from her mom.  A voice of truth in a sea of bullshit.",False,thats real parent real mother nothing real talk right learned well mom voice truth sea bullshit
UggJvtBuY7918HgCoAEC,dG7mZQvaQDk,finally a black person with a unbiased opinion. An incredibly high percentage of black lives are lost among themselves and only an extremely small fraction from police.  Black people need to take responsibility for their violence.,True,finally black person unbiased opinion incredibly high percentage black life lost among extremely small fraction police black people need take responsibility violence
UggkkDy5aXNO-HgCoAEC,dG7mZQvaQDk,"Thank you for the truth, and speaking for the innocent.",False,thank truth speaking innocent
UggLqnLTe5a1sngCoAEC,dG7mZQvaQDk,This is sad. Disgrace to all black people,True,sad disgrace black people
Uggma-nkAiK-eXgCoAEC,dG7mZQvaQDk,My mother told me the same thing.  God Bless this woman.,False,mother told thing god bless woman
UggomkAIZriFfXgCoAEC,dG7mZQvaQDk,"This gal calls it spot on! Way to go Ms.Peggy, way to go!",False,gal call spot way go mspeggy way go
UggPDp4D0K-7xngCoAEC,dG7mZQvaQDk,When I c the blk lives matter bullshit.....witch I call bullshit 5 black people were killed in a five period in Newark nj where were they....... I call Bullshitb,True,c blk life matter bullshitwitch call bullshit black people killed five period newark nj call bullshitb
UggQG0KuU_-llXgCoAEC,dG7mZQvaQDk,"Love it I same the saem thing Go Peggy!  #stupid  
Ya Killing ya selves more quicker than  STLPD could ever  #wakeup",False,love saem thing go peggy stupid ya killing ya self quicker stlpd could ever wakeup
UggrbvWF1tW0pHgCoAEC,dG7mZQvaQDk,Niggas love being the victim in any situation that's why I separate my from them and other black people need to do the same,True,nigga love victim situation thats separate black people need
UggrZgZguxyXq3gCoAEC,dG7mZQvaQDk,"Oh that politicians had the same style of oratory! Peggy Hubbard, in one short video, rings out a message that is loud and clear.....to those who will listen. Ok, I'm in England and thankfully we don't have a gun culture; but I've seen enough of the American scene in my time to know that Peggy drops all the hang-wringing crap to tell it as it is.
Her words should be written down and posted in the White House.....mavbe someone there would listen and act.",False,oh politician style oratory peggy hubbard one short video ring message loud clearto listen ok im england thankfully dont gun culture ive seen enough american scene time know peggy drop hangwringing crap tell word written posted white housemavbe someone would listen act
Uggs4V2kJ0QPg3gCoAEC,dG7mZQvaQDk,everyone share this......this women is awesome,False,everyone share thisthis woman awesome
UggSA9NX_RN3VXgCoAEC,dG7mZQvaQDk,This is REAL black leadership. Real revolutionary radicalism!,False,real black leadership real revolutionary radicalism
UggsmHAjXe_lhXgCoAEC,dG7mZQvaQDk,Respect!,False,respect
UggSpMI7lKPnc3gCoAEC,dG7mZQvaQDk,Thanks for being a voice of sanity in the black community Peggy.,False,thanks voice sanity black community peggy
UggVkCi8HJdrVHgCoAEC,dG7mZQvaQDk,"Wow!...people like me can't say these things she RIGHTLY says, because the ""PC police"" will get offended, tag me as racist, and therefore no truth I might speak is given credence....society as we know it. But her speaking the truth magnifies it like no one else could. Why aren't we elevating people like her to school boards, city councils, mayors, state and national office?",False,wowpeople like cant say thing rightly say pc police get offended tag racist therefore truth might speak given credencesociety know speaking truth magnifies like one else could arent elevating people like school board city council mayor state national office
UggWOhAGPSANkHgCoAEC,dG7mZQvaQDk,And she's a US Navy vet. Mad respect,False,shes u navy vet mad respect
UggZTfTyS3k6ZngCoAEC,dG7mZQvaQDk,"+ ~ day day ~
+ thisisacommentary

Here's some truth for you!",False,day day thisisacommentary here truth
Ugh3UPrEeTTHtHgCoAEC,dG7mZQvaQDk,"So this bitch is talking about people like Dylan Roof, James Holmes, Jared Loughner, Jerad Miller, Tim McVeigh, Jared Loughner, Jim David Adkisson, Paul Hill, Scott Roeder, Frazier Glen Miller Jr. Elliot Rodger, Buford O' Furrow, John R Houser, etc,. then RIGHT?",True,bitch talking people like dylan roof james holmes jared loughner jerad miller tim mcveigh jared loughner jim david adkisson paul hill scott roeder frazier glen miller jr elliot rodger buford furrow john r houser etc right
Ugh5BW50pf-9PngCoAEC,dG7mZQvaQDk,"Thank you for being real. When I heard about the little girl I thought the same thing.
Where is the rage! The Media and who is ever behind them want to promote racial tensions and nobody in the black community wants to talk about the elephant in the room. Its almost like everything in the media and music scene promotes a thug life.",False,thank real heard little girl thought thing rage medium ever behind want promote racial tension nobody black community want talk elephant room almost like everything medium music scene promotes thug life
Ugh5YyQl1LLLcHgCoAEC,dG7mZQvaQDk,Peggy is my hero..,False,peggy hero
Ugh9ieGAQW1ZdHgCoAEC,dG7mZQvaQDk,Awesome women.,False,awesome woman
Ugh9NJ5VcQj8fngCoAEC,dG7mZQvaQDk,"i think alot of black people are tired with gun violence and gangs and ignorance in their communities and want it to stop
  and yes their are bad people of all races but whats gets to me with that statement when you talk about things in the black commuity people are so quick to say their are bad people in every race and say your putting blacks down when you just want your people do better and caring their selfs in a repectful way",False,think alot black people tired gun violence gang ignorance community want stop yes bad people race whats get statement talk thing black commuity people quick say bad people every race say putting black want people better caring self repectful way
Ugh9-XU9MBpdPHgCoAEC,dG7mZQvaQDk,*Tips hat to this class A lady. Well spoken!,False,tip hat class lady well spoken
UghblI9yzalDUXgCoAEC,dG7mZQvaQDk,If only more black people were like her...,False,black people like
UghcaI1aYuZeLngCoAEC,dG7mZQvaQDk,She is right Blacks are in the shitter because of themselves not the white man.,True,right black shitter white man
UghcJ70N2jvmUXgCoAEC,dG7mZQvaQDk,"Obama should be saying exactly what this lady is saying.  Instead, he's defending the thugs.  She should clean up her language, however.",True,obama saying exactly lady saying instead he defending thug clean language however
UghFiMPAIdHjUXgCoAEC,dG7mZQvaQDk,"So proud of a woman & mother that stands on principle, morality & just plain common sense! And not afraid to go against the tide of her cultures wrong path! Kudos to you Peggy & also to the mother of the 2 kids in Hattiesburg, Ms. That killed 2 police officers... Then stands up and takes responsibility, as we all should. You two are wonderful role models and my latest heroines!",False,proud woman mother stand principle morality plain common sense afraid go tide culture wrong path kudos peggy also mother kid hattiesburg m killed police officer stand take responsibility two wonderful role model latest heroine
UghhqzDBAgfZFXgCoAEC,dG7mZQvaQDk,"basically she's doing more than talking. black lives do matter, but I guess when looting and rioting take place only for an asshole whose robbed and druged up the community . She hits on all points and was on CNN. She believes there is police brutality and Wants reforms, she knows theres racism, but she also knows nobody is going to take. a fucking second  look at black rights till black people take a stand against self destruction.",False,basically shes talking black life matter guess looting rioting take place asshole whose robbed druged community hit point cnn belief police brutality want reform know there racism also know nobody going take fucking second look black right till black people take stand self destruction
UghhReguIiBXz3gCoAEC,dG7mZQvaQDk,I've spread this video everywhere!!!! Awesome!,False,ive spread video everywhere awesome
UghI04c2fnCXw3gCoAEC,dG7mZQvaQDk,"Thank you, Peggy!",False,thank peggy
Ughj539YD_W0mHgCoAEC,dG7mZQvaQDk,The female Uncle Ruckus,False,female uncle ruckus
UghJfuhlGySl5XgCoAEC,dG7mZQvaQDk,Well damn. Good for her,False,well damn good
UghjSQWibrNXbHgCoAEC,dG7mZQvaQDk,"Im a white person who always thought everyone should be treated fairly.
With BLM and creating a bunch of bull and threatening my life and others by making it harder for cops to take out the bad guys, maybe not drawing their weapon fast enough or killing the spirit of being a hero or killing the spirit of NOT putting out 110% and doing JUST enough to comply. (No more rushing into burning houses type of thing) from a few bad cops

And with the neighborhood gangs in my neighborhood having the heat taken off them. Emboldening them.

 And not the spirit of ALL lives matter (A form of racism in itself)

BLM is causing a feeling that Black Lives don't matter.

Peggy gave me hope there is still hope that there is still intelligence in the black community. 
So maybe we can still all live together.
I'm one less white guy willing to join the KKK because of Peggy, NOT BLM.",True,im white person always thought everyone treated fairly blm creating bunch bull threatening life others making harder cop take bad guy maybe drawing weapon fast enough killing spirit hero killing spirit putting enough comply rushing burning house type thing bad cop neighborhood gang neighborhood heat taken emboldening spirit life matter form racism blm causing feeling black life dont matter peggy gave hope still hope still intelligence black community maybe still live together im one less white guy willing join kkk peggy blm
Ughk89bvzTZ5n3gCoAEC,dG7mZQvaQDk,I agree with this sista 100% !!!!!,False,agree sista
UghkOHwrD0EFVXgCoAEC,dG7mZQvaQDk,"As a black person all I have to say is THANK YOU FOR SPEAKING THE TRUTH. Too many blacks out there causing trouble, dressing like idiots and bring trouble to themselves, killing eachother, causing crimes then they complain the police are after them when they are up to no good. I'm just glad my parents grew me up properly. I stayed away from the garbage.",True,black person say thank speaking truth many black causing trouble dressing like idiot bring trouble killing eachother causing crime complain police good im glad parent grew properly stayed away garbage
UghLKEjKvHMPI3gCoAEC,dG7mZQvaQDk,"Thank you Mrs. Hubbard. I am so happy that you said what needs saying. Blacks are allowing their neighborhoods to be destroyed by themselves. Black mother's stand up and be counted. Black fathers keep your ass home and help raise your children. Peggy, Chief & I have your back. Fair winds and following seas shipmate. Slap heard round the world needs to happen a whole lot more my sisters.",False,thank mr hubbard happy said need saying black allowing neighborhood destroyed black mother stand counted black father keep as home help raise child peggy chief back fair wind following sea shipmate slap heard round world need happen whole lot sister
UghlxE3O2KiW0XgCoAEC,dG7mZQvaQDk,"You go girl!! ... have listened twice, retweeted twice (first from gateway pundent, second from youtube)  God Bless Ms Hubbard and God's speed with your vid.",False,go girl listened twice retweeted twice first gateway pundent second youtube god bless m hubbard god speed vid
Ughn4r9O-Nhkz3gCoAEC,dG7mZQvaQDk,Great video...Thank you Peggy.,False,great videothank peggy
Ugho94xeAVZ7NngCoAEC,dG7mZQvaQDk,This Brave woman brought tears to my eyes,False,brave woman brought tear eye
UghOMcTf-0StdHgCoAEC,dG7mZQvaQDk,PEGGY HUBBARD for PRESIDENT 2016 !!!!,False,peggy hubbard president
UghqvIGI8ffj3XgCoAEC,dG7mZQvaQDk,Very respectable woman,False,respectable woman
UghS3N0TuPkVzXgCoAEC,dG7mZQvaQDk,Too much logic and intelligence.  She must be mixed race with some intelligent white DNA in her.,True,much logic intelligence must mixed race intelligent white dna
UghtUAixv0nBhHgCoAEC,dG7mZQvaQDk,AMEN! Tell it like it is sister AMEN!,False,amen tell like sister amen
UghV9yjXGfrPXngCoAEC,dG7mZQvaQDk,We need more people like Peggy Hubbard! I support her as Mother of the Year with Common Sense.,False,need people like peggy hubbard support mother year common sense
Ughxvpwf-pvcs3gCoAEC,dG7mZQvaQDk,I think I just fell in love.,False,think fell love
UghZ4FemHXJvdXgCoAEC,dG7mZQvaQDk,One must be fucking stupid if one attacks a police officer and expects to get away with it without any response from the police.,True,one must fucking stupid one attack police officer expects get away without response police
UghzyVkP2QyrDHgCoAEC,dG7mZQvaQDk,"I never heard of this woman before.  But, I'm loving what she is saying.  This message is too valuable not to get out there.  Thanks for posting!",False,never heard woman im loving saying message valuable get thanks posting
Ugi2mKmoNhVvB3gCoAEC,dG7mZQvaQDk,"hit the nail on the head !! black lives matter, guess not when they keep killing each other over stupid shit . like gang loyalty and selling drugs instead of getting an education so you are able to get out of the getto your in . i take my hat off to those parents who raise there chlidren to have values and pride in who they are,cause those are the ones who will make a difference . not the drug dealing gang bangers . the only difference there going to makeis one less for the holiday dinners",False,hit nail head black life matter guess keep killing stupid shit like gang loyalty selling drug instead getting education able get getto take hat parent raise chlidren value pride arecause one make difference drug dealing gang banger difference going makeis one less holiday dinner
Ugi47Eld1QATNXgCoAEC,dG7mZQvaQDk,"Dear Peggy, can you please be all of our Mother and run for president?",False,dear peggy please mother run president
Ugib2A3yAXk6S3gCoAEC,dG7mZQvaQDk,"Plenty of white people do care, but when they have the exact same views as this woman they are deemed RACIST. I stopped caring",False,plenty white people care exact view woman deemed racist stopped caring
UgiBiwBL8fQNZHgCoAEC,dG7mZQvaQDk,LOOK DEEPER INTO WHY THIS HAPPENS ALL OVER. BLACK PEOPLE DID NOT PUT BLACK PEOPLE IN THIS SITUATION WE ARE ALL IN AS BLACK PEOPLE.  HOPE SHE LEARNS HER HISTORY!,False,look deeper happens black people put black people situation black people hope learns history
UgiCLhgoEYmK03gCoAEC,dG7mZQvaQDk,I love this woman. wish there were more like her. it would certainly help the cause if more were on the same page...,False,love woman wish like would certainly help cause page
UgiDEoauMjZ5AngCoAEC,dG7mZQvaQDk,That's just cruel of her as a mom,False,thats cruel mom
UgiDRFxEd3lXsHgCoAEC,dG7mZQvaQDk,She spoke what on others want to say....,False,spoke others want say
UgidWMSFYmz_mHgCoAEC,dG7mZQvaQDk,This women should get the NOBEL PEACE PRIZE instead of that Antichrist Obama.,False,woman get nobel peace prize instead antichrist obama
UgiFAwQp3PHa83gCoAEC,dG7mZQvaQDk,Bravo!,False,bravo
UgiFcOu0kpU9Q3gCoAEC,dG7mZQvaQDk,"Correction: Black ppl have NEVER been the most violent ppl on this planet.  Now some of what she is saying is true but, when it comes to this black on black crime shit,  don't just single my race out when the same shit happens with other races, all across the globe.",True,correction black ppl never violent ppl planet saying true come black black crime shit dont single race shit happens race across globe
Ugig_n0opz8ZeHgCoAEC,dG7mZQvaQDk,"I'm sure michael brown knew the killer of the young girl and considered him his ""homeboy""",False,im sure michael brown knew killer young girl considered homeboy
UgiGY5J-nefDBHgCoAEC,dG7mZQvaQDk,I love you Peggy.,False,love peggy
UgihSHhY4D6RH3gCoAEC,dG7mZQvaQDk,yeah what she said save us some tax dollars so we can buy parts for are harleys and ARs LOLOL,False,yeah said save u tax dollar buy part harleys ar lolol
UgijGlOjRf7hgngCoAEC,dG7mZQvaQDk,"Peggy, I know there are many more fine black women (and men) like you who are sick and tired of the violence and the blame. Thanks for speaking up!",False,peggy know many fine black woman men like sick tired violence blame thanks speaking
UgiMcpkO3TLefngCoAEC,dG7mZQvaQDk,"Awesome Job Peggy!  thank you for telling it how it is and the truth!!
 #WeStandWithPeggyHubbard",False,awesome job peggy thank telling truth westandwithpeggyhubbard
UgiMWjxMr-h5s3gCoAEC,dG7mZQvaQDk,"That community should be marching for peace hand in hand for the girl that was killed sitting in her home doing homework. She deserves at least that or society has let her down. Maybe Al Sharpton will lead ...
",False,community marching peace hand hand girl killed sitting home homework deserves least society let maybe al sharpton lead
UgioKj2LFNcorngCoAEC,dG7mZQvaQDk,"Truth delivered with the courage of conviction, not political correctness reaches the hearts and minds of the honest, productive and hard-working people. This lady says it like it is.",False,truth delivered courage conviction political correctness reach heart mind honest productive hardworking people lady say like
UgiovVFNjWPUJngCoAEC,dG7mZQvaQDk,Right On! Dynamite!,False,right dynamite
UgiP6G4sPnNUFXgCoAEC,dG7mZQvaQDk,You see if Blacks speak  the truth and don't conform to the norm they are considered Uncle Tom's and sell outs,False,see black speak truth dont conform norm considered uncle tom sell out
UgiTvwSX5Z1bzXgCoAEC,dG7mZQvaQDk,"So now a days, if you're Conservative, support the Confederate Flag,denies racism,and criticize black people; you're deemed a hero by white people? Lmao. Please get this white woman in black face off my screen",True,day youre conservative support confederate flagdenies racismand criticize black people youre deemed hero white people lmao please get white woman black face screen
UgiU3wgEiODazXgCoAEC,dG7mZQvaQDk,REAL strong black woman NOT afraid to speak the TRUTH.,False,real strong black woman afraid speak truth
UgiW5j_mTeEZ3XgCoAEC,dG7mZQvaQDk,Peggy I love your video and I once use to stand for black lives matters but now they are using it as an excuse to get away with crime. I know a lot of good blacks who would like their voices heard but their voices are silenced because of this nationwide uproar of black lives matters and their afraid if they say something they could be the next victim.,False,peggy love video use stand black life matter using excuse get away crime know lot good black would like voice heard voice silenced nationwide uproar black life matter afraid say something could next victim
UgixdxuPaLDtAXgCoAEC,dG7mZQvaQDk,"okay blacklivesmovent thugs  stop with this carp u wanna stand up for a murder but yet a child died by gettin shoot in the cheast all becasue u all wanna act like the plant of the apes movie all because of this excuse me black are killing other blacks and u wanna come after cops and white ppl  and call us names , rastist names all because u  dont get it try lisening to the lawa obeying the the law and stop shooting  inncent ppl  for you own  benfits all of u guys killing other ppl need to be in  jail,",True,okay blacklivesmovent thug stop carp u wanna stand murder yet child died gettin shoot cheast becasue u wanna act like plant ape movie excuse black killing black u wanna come cop white ppl call u name rastist name u dont get try lisening lawa obeying law stop shooting inncent ppl benfits u guy killing ppl need jail
UgiYmeHQGlK1X3gCoAEC,dG7mZQvaQDk,"You freakin' go, girl!!",False,freakin go girl
Ugj4EBpIx3VZw3gCoAEC,dG7mZQvaQDk,"AMEN!!!, Peggy Hubbard!! Color makes no difference, it's the person on the inside. The innocent nine year old little girl is the one attention should have been on. Some people just want to cause chaos, black and white!! All of what is going on is exactly what Obama wanted,now look at our country and this mess that it's in. I admire your courage and telling it like it is Peggy Hubbard.",True,amen peggy hubbard color make difference person inside innocent nine year old little girl one attention people want cause chaos black white going exactly obama wantednow look country mess admire courage telling like peggy hubbard
Ugj4qfkf_LybFHgCoAEC,dG7mZQvaQDk,one race ( the human race),False,one race human race
Ugj5MKvyX16BlngCoAEC,dG7mZQvaQDk,"OMG! She is putting it all out there, telling the truth. It's hard, but it's true.",False,omg putting telling truth hard true
Ugj6D2gOXUlNNHgCoAEC,dG7mZQvaQDk,"Before integration black people had their own schools , business and  banks !!!!!!  After integration they lost every thing !!!!!!",True,integration black people school business bank integration lost every thing
Ugj6Z_0sLPBlSHgCoAEC,dG7mZQvaQDk,No! Leave it alone! Don't take it down!,False,leave alone dont take
Ugj7onbAIhP0jXgCoAEC,dG7mZQvaQDk,Wake up Black People.,False,wake black people
Ugj9BpURKo9iMXgCoAEC,dG7mZQvaQDk,"This older, white conservative says Peggy for Vice President! Could you imagine a Trump/Hubbard ticket? WOWEEE WOW!",False,older white conservative say peggy vice president could imagine trumphubbard ticket woweee wow
Ugj9q6R3gxZpj3gCoAEC,dG7mZQvaQDk,pretty woman dang!,False,pretty woman dang
