CommentId,VideoId,Text,IsToxic,text_procesado
UghTL-UF1SEwzHgCoAEC,4rCweDxDqdw,While I agree with most of your report and I certainly think that the events that went down in Ferguson need to be investigated. Your statistics to support a targeting of a particular race by number of stops and searches can certainly be explained away by the fact that most of the population in that region is of a particular race given a greater opportunity that someone who is stopped is most likely going to be of that race. I think further analysis would need to be conducted to make that collation. I am not saying race is not a factor. I am saying statistics can be misleading and need to be considered thoughtfully before stating them as support for a statement.,False,agree report certainly think event went ferguson need investigated statistic support targeting particular race number stop search certainly explained away fact population region particular race given greater opportunity someone stopped likely going race think analysis would need conducted make collation saying race factor saying statistic misleading need considered thoughtfully stating support statement
Ughtzm6ks6FsIXgCoAEC,4rCweDxDqdw,"Its funny doctors push drugs its legal, even tho prescription drugs are abused the most, whereas minorities get locked up for years because of marijuana known to be beneficial to the economy. The war on drugs started with the government who still supplies the streets to this day. Racial profiling is stupid. Caucasians commit the most mass shootings I don't see them being searched before they go in malls, movie theaters, schools etc",False,funny doctor push drug legal even tho prescription drug abused whereas minority get locked year marijuana known beneficial economy war drug started government still supply street day racial profiling stupid caucasian commit mass shooting dont see searched go mall movie theater school etc
UghzjrDLqleo9HgCoAEC,4rCweDxDqdw,"So you're implying that because most of Ferguson is black, but most of their elected or appointed officials are white, that it means that the majority of people in Ferguson isn't represented at all? That they mostly black population wouldn't happen to have voted for or support the white officials? And just because its median income is lower than that of MO or the US as a whole, is that because its population is mostly black, or is it just a statistic?",False,youre implying ferguson black elected appointed official white mean majority people ferguson isnt represented mostly black population wouldnt happen voted support white official median income lower mo u whole population mostly black statistic
Ugi_4iRsu9Skx3gCoAEC,4rCweDxDqdw," Ridiculous liberal tripe meant to divide us along race/class barriers even more

If Blacks(I refuse to use the word African American) are oppressed by local Government then the community should band together and vote them out. Vote more blacks in. This is why we live in a Democratic Republic.
   Sorry, most of your arguments are nothing more than excuses and your criminal stats are the result of a large black community(68%?).  Blacks really need to stop listening to Democrats who preach a, ""You cannot win because the deck is stacked against you"" oppressive lifestyle. They'll never rise above their current conditions if they cling to liberal excuses. It's not the color of your skin, its the overall presentation. ",False,ridiculous liberal tripe meant divide u along raceclass barrier even blacksi refuse use word african american oppressed local government community band together vote vote black live democratic republic sorry argument nothing excuse criminal stats result large black community black really need stop listening democrat preach cannot win deck stacked oppressive lifestyle theyll never rise current condition cling liberal excuse color skin overall presentation
Ugi4kKODyEmlvXgCoAEC,4rCweDxDqdw,"Someone has to say this so I will.
With the way most black people behave no wonder Ferguson is such a shitty place.
Most black people in the US are so fucking lazy.
I am saying this because of countless examples from my life:
1. My grandmother got a black house nurse once and the bitch did nothing all day. When my grandmother complained to the agency they sent a different woman (wasn't black) that cleaned the entire house in 4 hours.
2. My mom works at a hospital as a nurse and all her black co workers constantly do nothing and are lazy.
Now once again. not all black people are like this (one of my best friends is black and I like him like a brother) but most of them are. The fucks expect to get everything they want only because their ancestors were once slaves. 
Well, Hitler killed most of my ancestors, do you see me with sagging pants and crying like a stupid bitch about it like those stupid black people?

The inequality of representation is probably because (again) black people are generally lazy or lack the skills required to hold such positions. 
The household income ties into my previous point (lazy/lacking skill = lower income jobs).
The dropout rate from school need to be taken against the black people at Ferguson, because, once again, how will you hold a high paying job if you didn't even graduate fucking high school?
The 80% worse healthcare is once again tied into the low income. More money = better doctors.
As for the inequality of enforcement, I have to give you that one that is completely unfair, however, when looking at black officers they frisk mostly black people as well, hmmmm..... interesting? maybe.",True,someone say way black people behave wonder ferguson shitty place black people u fucking lazy saying countless example life grandmother got black house nurse bitch nothing day grandmother complained agency sent different woman wasnt black cleaned entire house hour mom work hospital nurse black co worker constantly nothing lazy black people like one best friend black like like brother fuck expect get everything want ancestor slave well hitler killed ancestor see sagging pant cry like stupid bitch like stupid black people inequality representation probably black people generally lazy lack skill required hold position household income tie previous point lazylacking skill lower income job dropout rate school need taken black people ferguson hold high paying job didnt even graduate fucking high school worse healthcare tied low income money better doctor inequality enforcement give one completely unfair however looking black officer frisk mostly black people well hmmmm interesting maybe
Ugi74Ltg5U6W4XgCoAEC,4rCweDxDqdw,I might be wrong but when a majority of the black community don't vote wouldn't it make sense for there to be an inequality in the city government.,False,might wrong majority black community dont vote wouldnt make sense inequality city government
Ugi7FqQWmQYFGXgCoAEC,4rCweDxDqdw,Is there something wrong with her voice?,False,something wrong voice
UgignRhfXmAlhXgCoAEC,4rCweDxDqdw,"The more those people fuck up America, the more American will fucking hate them. ",True,people fuck america american fucking hate
UgimajRNYpD17XgCoAEC,4rCweDxDqdw,Bill Cosby caused them,False,bill cosby caused
UgiYcJff050IdHgCoAEC,4rCweDxDqdw,"The US Justice Department has audited the Ferguson Police Department and found 180 counts of excessive use of police force against African-Americans from 2009-2014.  In addition, they found 7 emails containing discriminatory language on Department computers.  The Federal government is pursuing a criminal case against the Ferguson Police Department.  I wonder if Bob McCulloch will try to defend this one.",False,u justice department audited ferguson police department found count excessive use police force africanamericans addition found email containing discriminatory language department computer federal government pursuing criminal case ferguson police department wonder bob mcculloch try defend one
UgiZ0uPciaqqCHgCoAEC,4rCweDxDqdw,Is there something wrong with the audio?,False,something wrong audio
Ugj6KaiR6Y27RngCoAEC,4rCweDxDqdw,that's just flat out racist to say one race can't represent another equally. if majority blacks voted for the white people does that mean the blacks that voted didn't vote for their own best interest? and that the elected white official can't represent the black voters that put him/her in office?,False,thats flat racist say one race cant represent another equally majority black voted white people mean black voted didnt vote best interest elected white official cant represent black voter put himher office
UgjEVu1dSOaIJ3gCoAEC,4rCweDxDqdw,"The report on the 'Inequality of Enforcement' statistics can be found in the description, and here:
http://ago.mo.gov/VehicleStops/2013/reports/161.pdf

To those who are questioning the math here, please check it for yourself, we're not here to teach basic algebra! These numbers are not proportional. Our video scratches the surface, and we do encourage you to do supplemental research on their own if you wish to know more.",False,report inequality enforcement statistic found description questioning math please check teach basic algebra number proportional video scratch surface encourage supplemental research wish know
UgjeXpjsshe9GHgCoAEC,4rCweDxDqdw,What's with all the dislikes? White people are that offended? You thought racism wasn't an issue anymore....think again,True,whats dislike white people offended thought racism wasnt issue anymorethink
UgjGXwDAaQDElXgCoAEC,4rCweDxDqdw,How come they call the 'blacks' African Americans but not European American to the 'whites' ?,False,come call black african american european american white
UgjhYhKJO47d-XgCoAEC,4rCweDxDqdw," Did the IDIOT reporter do the survey on the percent of blacks that are involved in the following:- Gang Activities
ShopLifting
Car Jacking
Robberies
Robberies with assault
Teenage Pregnancies",True,idiot reporter survey percent black involved following gang activity shoplifting car jacking robbery robbery assault teenage pregnancy
UgjMdghS2VaoXHgCoAEC,4rCweDxDqdw,"""Here there is no racism, here, you are all equally worthless!"" - Full Metal Jacket",False,racism equally worthless full metal jacket
Ugj-oYTmB9sg6ngCoAEC,4rCweDxDqdw,"TestTube. Can you please explain to me how blacks get stopped and searched more than whites? If whites get make up 29% of the population and get searched 6.9% of the time while blacks make up 67% of the population and get searched 12.1% of the time, it's pretty obvious that whites are likely to get searched MORE. Do you want me to explain it further why that is or can you find someone in your team that actually remembers basic grade school math? I could go on and on about what is wrong about this video but it seems to have been already explained by others. Seriously, I do enjoy watching your channel, but the bias is strong with this one and almost made me want to unsubscribe. ",False,testtube please explain black get stopped searched white white get make population get searched time black make population get searched time pretty obvious white likely get searched want explain find someone team actually remembers basic grade school math could go wrong video seems already explained others seriously enjoy watching channel bias strong one almost made want unsubscribe
UgjpvWbzRLwcsHgCoAEC,4rCweDxDqdw,"If the majority of the people in Ferguson are African American than why are their elected officials not African American? The mayor, city council, and police chief are all elected officials.  Are the people in the community not stepping up to fill those roles?",False,majority people ferguson african american elected official african american mayor city council police chief elected official people community stepping fill role
UgjRkXbzGzSBHngCoAEC,4rCweDxDqdw,My least favorite test tube video so far.,False,least favorite test tube video far
UgjWd_JsIlOo9XgCoAEC,4rCweDxDqdw,"heard a Billionaire funded these organised riots ,what a fucken suck joke",True,heard billionaire funded organised riot fucken suck joke
UgjyZIj3j48MXngCoAEC,4rCweDxDqdw,Please slow down! I cant tell if they sped up Ms Scully or if she was talking really quickly. Great video with great information it was just a little fast. ,False,please slow cant tell sped m scully talking really quickly great video great information little fast
UgzaiZ1HSxzNP7RuC8V4AaABAg,4rCweDxDqdw,While i dont agree with police action to kill the boy but that does not mean you can protest by looting and destroying your own neighbourhood. That is stupid because it makes people don't want to support your struggle.,False,dont agree police action kill boy mean protest looting destroying neighbourhood stupid make people dont want support struggle
UggLdovvjLOAV3gCoAEC,5vF4si3hoRA,Fucking savages! Protest sumthing real... Like how your government is robbing you and sendin your kids to an elegal WAR! You are the laughing stock of America congrats!,True,fucking savage protest sumthing real like government robbing sendin kid elegal war laughing stock america congrats
Ugh79Qc3dbNIKHgCoAEC,5vF4si3hoRA,i just came here to read the racist comments lol,False,came read racist comment lol
UghzXm6KuFRXiXgCoAEC,5vF4si3hoRA,sure some of the people protesting are actually protesting for what they believe in but then you have those people that are taking advantage of a sad situation just to cause so much chaos and damage to a hurting community,False,sure people protesting actually protesting believe people taking advantage sad situation cause much chaos damage hurting community
UgiTGy7BpATRg3gCoAEC,5vF4si3hoRA,We need to come togather,False,need come togather
UgjDbvsTSk3YqngCoAEC,5vF4si3hoRA,Dont call peacefully protest.. When you burn down a car lol,False,dont call peacefully protest burn car lol
UgjTdFn9GIs9dngCoAEC,5vF4si3hoRA,"And in this section ladies and gentlemen, you will see black people misbehaving. I wonder what would happen if everyone rioted when court decisions do not go their way.",True,section lady gentleman see black people misbehaving wonder would happen everyone rioted court decision go way
Ugwz4Qt5dHpq1CN3e6x4AaABAg,5vF4si3hoRA,Dirtbags all of them. Including CNN,True,dirtbags including cnn
UgzHiTJpcabrtTKDJXJ4AaABAg,5vF4si3hoRA,Why were protesters throwing stuff at the reporters,False,protester throwing stuff reporter
Ugg6zFEJoC75_3gCoAEC,8HB18hZrhXc,Guy @ 0:34 just got a hard on.....,False,guy got hard
Uggk77ZgVKBK7ngCoAEC,8HB18hZrhXc,"As I watched I kept muttering shoot, shoot, pull the trigger. Rubber bullets hurt like a MFer.",True,watched kept muttering shoot shoot pull trigger rubber bullet hurt like mfer
UggNotjamqXzKHgCoAEC,8HB18hZrhXc,Send them to france,False,send france
UgguTFgWowTmWHgCoAEC,8HB18hZrhXc,Fun Fact: they did not have live ammo in those guns they had rubber slugs,False,fun fact live ammo gun rubber slug
UghBlbV9tbPVqXgCoAEC,8HB18hZrhXc,how fucking brain dead do you have to be to let the Nazi police scum bags just take you in,True,fucking brain dead let nazi police scum bag take
UghFKFz1sE6uOXgCoAEC,8HB18hZrhXc,"""Dis be furgusun in de unitid stateth o' murka!"" - Retard starts violent protest and then tries to pawn off the 'police state' lie when the cops arrive.",True,dis furgusun de unitid stateth murka retard start violent protest try pawn police state lie cop arrive
UghJiwZHx0DaT3gCoAEC,8HB18hZrhXc,GOD bless the Police.,False,god bless police
UghuRUmx8vyL8HgCoAEC,8HB18hZrhXc,"USA land of the free baby. HAHAHAHA! All you people not living in USA, should be thankful everyday. This is the worse country on earth.",True,usa land free baby hahahaha people living usa thankful everyday worse country earth
UghVaJ1e2NLNB3gCoAEC,8HB18hZrhXc,Was this in Virginia?,False,virginia
UghysYA5E5uRB3gCoAEC,8HB18hZrhXc,wow need to get your shit straight they never had there weapons pointed at any one in this vid they were at the ready position due to a riot and very under understandable course of action for any one who knows anything,False,wow need get shit straight never weapon pointed one vid ready position due riot understandable course action one know anything
Ugi_8PajECy1t3gCoAEC,8HB18hZrhXc,no dumber people on earth then americans,True,dumber people earth american
Ugi4NlXtbb117ngCoAEC,8HB18hZrhXc,At .16  screw the price of crap that thinks he's cool to disrespect the AMERICAN FLAG.,True,screw price crap think he cool disrespect american flag
Ugi8q6P9SfsxSHgCoAEC,8HB18hZrhXc,shoot first ask questions later hahahahahaha,True,shoot first ask question later hahahahahaha
UgiAV0VaJLBGaXgCoAEC,8HB18hZrhXc,What police? That was the army....,False,police army
UgibkIHcKYp4UHgCoAEC,8HB18hZrhXc,should have shot,True,shot
UgiE08q1WAgicHgCoAEC,8HB18hZrhXc,"A true dictatorship ! Let's wait and check which of the coutries will start sanctioning on U.S government? I guess none of countries, because USA is a corrupted all of countries in the world except Russia and China.",True,true dictatorship let wait check coutries start sanctioning u government guess none country usa corrupted country world except russia china
UgimA8UbV8KGhHgCoAEC,8HB18hZrhXc,"I'm at this point where I think if a cop points a gun at me I should just, you know, do as I'm told, that something I did provoked that.",False,im point think cop point gun know im told something provoked
UgirgdBRGumedHgCoAEC,8HB18hZrhXc,techno party!!!,False,techno party
Ugj0Rz556abCWXgCoAEC,8HB18hZrhXc,awesome job from our law enforcement now send off to disrupt & tear down all the Islamic extremist radicals in America thanks....,True,awesome job law enforcement send disrupt tear islamic extremist radical america thanks
UgjJk7DGYGixbXgCoAEC,8HB18hZrhXc,to bad those weapons were not discharged,True,bad weapon discharged
Ugjl7AwhYA5GRngCoAEC,8HB18hZrhXc,"not once did obama show hos face in these cities ,yet they supported him......sad",False,obama show ho face city yet supported himsad
UgjP3NatTbwQvngCoAEC,8HB18hZrhXc,"Wait, so who was rioting again? The people standing boredly on the sidewalk, or the guys with guns in the middle of traffic?",False,wait rioting people standing boredly sidewalk guy gun middle traffic
Ugjsa_VIAXYDB3gCoAEC,8HB18hZrhXc,Police cleaned that mess up quick! Nice.,True,police cleaned mess quick nice
UgjvMt-VLLvyA3gCoAEC,8HB18hZrhXc,i find this satisfying for some reason,True,find satisfying reason
Ugjzes4W9Oysw3gCoAEC,8HB18hZrhXc,Confederation ill be back?,False,confederation ill back
Ugw0Vori1c-fkupDw1d4AaABAg,8HB18hZrhXc,"Those guns use rubber bullets, stupid Russian news channel",True,gun use rubber bullet stupid russian news channel
UgwfTwcX9w7N8Kupt_R4AaABAg,8HB18hZrhXc,Perfect police,False,perfect police
UgwLke0YX9B8KLIuM3x4AaABAg,8HB18hZrhXc,Protesters suck,True,protester suck
Ugwo8nzTZpq35EEUSfJ4AaABAg,8HB18hZrhXc,"a rocket launcher will take care of that lightly armored vehicle, lol",True,rocket launcher take care lightly armored vehicle lol
UgwzfTejqSMgq_kKC9t4AaABAg,8HB18hZrhXc,Too bad that these were riot shotguns and not loaded with live rounds.,True,bad riot shotgun loaded live round
UgwzOgIFyi7D7CbU4Nt4AaABAg,8HB18hZrhXc,Time to test the police guns fire fire.,True,time test police gun fire fire
Ugy3x2UAt4XUcipNTeZ4AaABAg,8HB18hZrhXc,Buy ak47 shoot all USA copa,True,buy ak shoot usa copa
Ugy8ASEo1XznyO4B0tR4AaABAg,8HB18hZrhXc,"Ah, beautiful.",True,ah beautiful
Ugyg_kgb1QWkAWdEKsd4AaABAg,8HB18hZrhXc,Kill all protesters,True,kill protester
UgyqcqgyR0dUfI1J59J4AaABAg,8HB18hZrhXc,I think that all you guys are doing is profiting of all these standoff’s and not caring about one side or the other.,False,think guy profiting standoff caring one side
Ugy-S1A2qBkifEb2E-94AaABAg,8HB18hZrhXc,Blue lives let’s matter send those BLM commies our of our streets,True,blue life let matter send blm commie street
UgzpYKnjIcmB7Ch15YR4AaABAg,8HB18hZrhXc,"I'm with cops. Those protesters steal, and destroy things. They aren't solving shit",True,im cop protester steal destroy thing arent solving shit
UgzQ9csI7aKaeN1tmgd4AaABAg,8HB18hZrhXc,"And here you see it. They impose ""gunlaws"". In fact. Even if you had a machine gun, people could not do anything against the police. They have cars and body protection like tanks. Just wanted to say.",False,see impose gunlaws fact even machine gun people could anything police car body protection like tank wanted say
Ugg_vc9Qh3OaNHgCoAEC,9pr1oE34bIM,"Our shit serving media concocts a story, white cop kills an innocent black teenager, which is bullshit, to get the ""black community"" up in arms, they burn shit down..more stories for these useless talking heads to get in front of a camera with. At least once a week i see a black on white crime reported on the news..no national attention , no federal involvement...wtf? Black men need to stand up and be fathers and stop looking for excuses.. fuck yall.. all yall.",True,shit serving medium concocts story white cop kill innocent black teenager bullshit get black community arm burn shit downmore story useless talking head get front camera least week see black white crime reported newsno national attention federal involvementwtf black men need stand father stop looking excuse fuck yall yall
Ugg2dih3yblPRXgCoAEC,9pr1oE34bIM,What does this video have to do with what actually happen? You are simply trying to smear this young man’s image. So what he wanted to be a rapper. So what he stole some cigars? Nothing you have side in this video deserves a death sentence. Also now that they have released new video of Officer Wilson showing that he had no injuries. It shows that Officer Wilson is not being truthful about the incident. Perhaps you need to wait until all the details are out before you post a bias video. If you’re going to post a video make sure that it is accurate. Not to mention that you had more than just his friend the criminal who stated that Brown was giving up. You had both black and white witnesses who had nothing to do with the incident who stated that he had his hands up and was surrendering when Wilson shot him.,False,video actually happen simply trying smear young man image wanted rapper stole cigar nothing side video deserves death sentence also released new video officer wilson showing injury show officer wilson truthful incident perhaps need wait detail post bias video youre going post video make sure accurate mention friend criminal stated brown giving black white witness nothing incident stated hand surrendering wilson shot
Ugg3C07ZWc-6fngCoAEC,9pr1oE34bIM,Funny to thing the government can be trusted to judge itself. Fucking disgusting. ,True,funny thing government trusted judge fucking disgusting
Ugg4cH1XN-JfmHgCoAEC,9pr1oE34bIM,"What is the relevance of marijuana here?

The autopsy shows the entry wounds spread out over the body. In close range, the spread would be tight, most hitting the same region and most likely the chest area. But from long range, the spread would be dispersed as we see in the report and the wounds are on the underside of the arms, only exposed if the arms are raised or out in a ""gesture of peace"" IE ""my hands are empty and away from my body"" pose.
This plus there were no powder burns on the body.
He was far away.",False,relevance marijuana autopsy show entry wound spread body close range spread would tight hitting region likely chest area long range spread would dispersed see report wound underside arm exposed arm raised gesture peace ie hand empty away body pose plus powder burn body far away
Ugg5cceWlk2wKXgCoAEC,9pr1oE34bIM,"You know its crazy.... I actually came across your video about bitcoin while trying to learn more about it and knew you looked familiar.... I took the time to look at some of Mike Browns personal profiles myself specifically his soundcloud. While I do think he is guilty of representing himself in the wrong light and maybe of stealing he still didn't deserve to die. The fact that WHITE people like yourself continued to insinuate it is ridiculous and shows your clear lack of empathy and sympathy. It seems you all are more like the ""animals"" you think we are..... And its especially offensive looking back at these videos 3 years later when hip/hop rnb (OUR BLACK CULTURE) is the biggest thing and media and you still dont understand our perspectives. To say Trayvon Martin was making lean in on of your other videos shows how ignorant you truly are as well. Sprite or Fanta or a CARBONATED DRINK is used when making lean....Not tea....",True,know crazy actually came across video bitcoin trying learn knew looked familiar took time look mike brown personal profile specifically soundcloud think guilty representing wrong light maybe stealing still didnt deserve die fact white people like continued insinuate ridiculous show clear lack empathy sympathy seems like animal think especially offensive looking back video year later hiphop rnb black culture biggest thing medium still dont understand perspective say trayvon martin making lean video show ignorant truly well sprite fanta carbonated drink used making leannot tea
Ugg6J6cjEFf8cXgCoAEC,9pr1oE34bIM,"Stefan , I like how you standup for Darren Wilson though. Your side of events lose their integrity when you give him a clean chit considering how incompetent the Ferguson police are turning out to be. ",False,stefan like standup darren wilson though side event lose integrity give clean chit considering incompetent ferguson police turning
Ugg7tmaAPXIEingCoAEC,9pr1oE34bIM,"This is the typical mindset of white people ( not all white people but most). He deserved it . So I say to you, people like Sean Hannity are feuling the fires of prejudice and racism. Don't let these people influence you. They want a race war so they can start marshall law.",True,typical mindset white people white people deserved say people like sean hannity feuling fire prejudice racism dont let people influence want race war start marshall law
