CommentId,VideoId,Text,IsToxic,text_procesado
UghyXMdiUS3R6XgCoAEC,9pr1oE34bIM,I have told some people on facebook to hold off judgment till the all the facts are in. I just like waiting and seeing all the facts. Part of me wants to believe Mr. Brown is a gentle giant but there a lot of evidence he not.,False,told people facebook hold judgment till fact like waiting seeing fact part want believe mr brown gentle giant lot evidence
UghZ0GxRWjjtzXgCoAEC,9pr1oE34bIM,we might as well get the next round of riots over w/ when the police officer is cleared of any wrong doing...,False,might well get next round riot w police officer cleared wrong
UghZdtO-X_OiGHgCoAEC,9pr1oE34bIM,"No longer allegedly Michael Brown in the video, confirmed by his family.",False,longer allegedly michael brown video confirmed family
Ugi_6fj40d8GBngCoAEC,9pr1oE34bIM,"Well, we all know the truth today and yet we still hear the ""hands up, don't shoot"" BULLSHIT lie (see Beyonce). . .Yet we still see this moniker being used as a reason (lie) to shoot at Cops and outright assassinate them.",True,well know truth today yet still hear hand dont shoot bullshit lie see beyonce yet still see moniker used reason lie shoot cop outright assassinate
Ugi_ofJvcozDSXgCoAEC,9pr1oE34bIM,love the rap section!,False,love rap section
Ugi28hnRXGuoEngCoAEC,9pr1oE34bIM,Just so everyone knows more white people die from cops than blacks even though blacks get arrested at more than double the rate whites do. Less than 1% of arrest end in shootings. Less than 1/4 of people killed by police are black. Courtesy the FBI statistics. Maybe we should worry about why blacks commit much more crimes and yet they are out numbered about 5 to 1 in the general population. oh and ten years ago the crime rate and employment rate for blacks was better than it is now.,False,everyone know white people die cop black even though black get arrested double rate white less arrest end shooting less people killed police black courtesy fbi statistic maybe worry black commit much crime yet numbered general population oh ten year ago crime rate employment rate black better
Ugi2D2J9ryibsngCoAEC,9pr1oE34bIM,12:28 - can someone please turn that into an auto-tune rap song by Stefan Molyneux? Please.,False,someone please turn autotune rap song stefan molyneux please
Ugi3jDCc-p-YU3gCoAEC,9pr1oE34bIM,"the guy was a monster, he got what he deserved, color didn't matter. anyone that attacks a guy with a gun is gonna get shot.......he did a stupid illegal act tried hurting someone and got blasted. give the cop a raise",True,guy monster got deserved color didnt matter anyone attack guy gun gonna get shothe stupid illegal act tried hurting someone got blasted give cop raise
Ugi4EuOX3ajKEXgCoAEC,9pr1oE34bIM,Molyneux tête de noeud !,False,molyneux tte de noeud
Ugi7qter96VmungCoAEC,9pr1oE34bIM,"moly loooooooooooooooooooooooves cops.  there are other witnesses.  also clueless about the 'riots'.  also about the decades of police violence and repression in the area....also, ignorant of the effects of marijuana.",False,moly loooooooooooooooooooooooves cop witness also clueless riot also decade police violence repression areaalso ignorant effect marijuana
Ugi90oP3_nO3lXgCoAEC,9pr1oE34bIM,"The 1,879 people the disliked this video are the problem. This man said nothing wrong. And until they change, which will not happen, it will not change. The good thing is you are still very out numbered.",False,people disliked video problem man said nothing wrong change happen change good thing still numbered
UgiaCs0lyI-CGXgCoAEC,9pr1oE34bIM,"If no state, no cop; no cop, no shooting. So the state is the problem, right? Anarcho-capitalists like Steffan should agree with this nonsense.",False,state cop cop shooting state problem right anarchocapitalists like steffan agree nonsense
UgiAxtQoe6zezHgCoAEC,9pr1oE34bIM,racist piece of shit you reach for anything to justify murder. it is extremely shameful how you slant facts in order to justify your racist and biased views. ,True,racist piece shit reach anything justify murder extremely shameful slant fact order justify racist biased view
UgiBd5_JgZmkLXgCoAEC,9pr1oE34bIM,"Dear Mr. Stephen Molyneux, 40 minutes is a bit long, but you are 100% right! You respond only after all facts are in . BTW, I voted the thumb up and the number (5729 )did not even blink. ( I have tried the thumb down and must say the same thing happened = to be fair.....)  Thank you for your homework and your hard work. Obviously you spent a lot of time to present this case to us. Very nice of you. Obviously you care very much about your country.  All the best !",False,dear mr stephen molyneux minute bit long right respond fact btw voted thumb number even blink tried thumb must say thing happened fair thank homework hard work obviously spent lot time present case u nice obviously care much country best
Ugibs9zqNcyXY3gCoAEC,9pr1oE34bIM,please do a follow-up video if u get enough new information. thx for your time and great work as always.,False,please followup video u get enough new information thx time great work always
UgicaQKABWnGzngCoAEC,9pr1oE34bIM,"When are people of this country going to learn, it isn't the police that is the enemy, it is the MEDIA..they are the ones lighting the so called fire, and stirring the pot...",False,people country going learn isnt police enemy mediathey one lighting called fire stirring pot
UgicXd44QtS0D3gCoAEC,9pr1oE34bIM,"As always Mr. Molyneux, excellent video.",False,always mr molyneux excellent video
UgidFDMnBCsYXngCoAEC,9pr1oE34bIM,"Stop advertising swisher sweets lol , ur a racist point blank  .",True,stop advertising swisher sweet lol ur racist point blank
UgiDwqea9kPlTXgCoAEC,9pr1oE34bIM,This man has an intelligence the average black man can't comprehend.  Its like a dog trying to figure out how man makes a house.,True,man intelligence average black man cant comprehend like dog trying figure man make house
UgidxPTMDu9633gCoAEC,9pr1oE34bIM,"I loved your Trayvon Martin video and I love this one too. I wish you could deliver cable news, maybe then people would get the truth.",False,loved trayvon martin video love one wish could deliver cable news maybe people would get truth
Ugie6_SVDwjE4HgCoAEC,9pr1oE34bIM,"and the robbery video leaves one with more questions than answers...
He put 'something' on the clerks counter when he entered the store... MONEY .... ??? Watch carefully... He had 'something' in his hand when he entered, plus pulled something out of his pockets, Money??? ... and put it on the counter... These surveillance have audio ability.... there was a conversation at the clerks window as well
I'm just saying....﻿
some of the videos posted are longer and have more depth.... the clerk and him had an exchange at the window... we don't know what was said, we don't know.... if the money was sufficient for the items... etc...",False,robbery video leaf one question answer put something clerk counter entered store money watch carefully something hand entered plus pulled something pocket money put counter surveillance audio ability conversation clerk window well im saying video posted longer depth clerk exchange window dont know said dont know money sufficient item etc
UgiEU3lZZ276EXgCoAEC,9pr1oE34bIM,"I hope the next video will be entitled ""The Truth about the Ferguson police department and the Ferguson riots"". Thanks for the usual quality research but there are two issues match and gasoline. Riot control of otherwise peaceful protestors, homeowners refusing to go inside and members of the press are clear symptoms of something out of the normal for small town police. Sanford police had similar protests incuding looting but resisted such escalation.",False,hope next video entitled truth ferguson police department ferguson riot thanks usual quality research two issue match gasoline riot control otherwise peaceful protestors homeowner refusing go inside member press clear symptom something normal small town police sanford police similar protest incuding looting resisted escalation
Ugifhdx2Nn8PQ3gCoAEC,9pr1oE34bIM,"Here's another fine Ferguson officer.  Man, they really got the cream of the crop in that town!  LOL  http://thefreethoughtproject.com/ferguson-cop-choked-hog-tied-12-year-old-accused-assault/",False,here another fine ferguson officer man really got cream crop town lol
UgifnKoH5e8fIHgCoAEC,9pr1oE34bIM,"the fate of another neglected child
would be interesting to know his family background... always keep in mind that children emulate social behaviour...",False,fate another neglected child would interesting know family background always keep mind child emulate social behaviour
UgiFSYf7PhDUd3gCoAEC,9pr1oE34bIM,Good commentary.  Perceptive and fair.,False,good commentary perceptive fair
UgigJWvhjPTtDXgCoAEC,9pr1oE34bIM,"Whether you're right or wrong about the Michael Brown case has nothing to do with ""left wing"" policies. Please stop conflating the issues. ",False,whether youre right wrong michael brown case nothing left wing policy please stop conflating issue
Ugigl4XGkNFMMHgCoAEC,9pr1oE34bIM,"He was Robbing the Store and Being a Big Man .
If you Play with Fire you Will Get Burnt .?
The Police Did His Job .",False,robbing store big man play fire get burnt police job
UgihE6xeiPTihHgCoAEC,9pr1oE34bIM,Link between poor little tryvon martin and little mr brown? Yeah they were both thug's that tired to beat the white person into the ground and got shot for their effords...end of story,True,link poor little tryvon martin little mr brown yeah thug tired beat white person ground got shot effordsend story
UgiHPN6Pa7633ngCoAEC,9pr1oE34bIM,"Fascinating to hear actual facts, especially compared with the twisted nonsense coming out of the main media outlets.",False,fascinating hear actual fact especially compared twisted nonsense coming main medium outlet
UgihxPDXGDbsyXgCoAEC,9pr1oE34bIM,Michale brown got what he was asking for the black protestors are racist against whites that is what's happening,True,michale brown got asking black protestors racist white whats happening
UgiIiGH-eTP3AXgCoAEC,9pr1oE34bIM,"As a white guy, if you are really concerned with the plight of the black community (which I doubt that you are) you should spend some time just hanging around black guys in the community just to see how the world reacts to them and how they react to the world.  And not just a few times either.  Secondly, if you think anyone even hoped up on drugs charges after feeling a gunshot after at first fleeing a shooter, what kind of fantasy do you live in.  You must think blacks will do shit anything with a survival mechanism in this world would not do.   Police officers doing the right thing gives us comfort in our lives and you want to believe the cops story.  

Here is another story cop gets out to start some cop harassment type antics (as all cops do).  Kid gives him some 18 year old fat fuck that thinks he can whip everybody's ass sass.   He hits the kid with the door, dumb ass kid instead of passing out and getting the officer fired and paid and a few dollars for his injuries, pushes the door back.  Officer grabs him by the neck and a scuffle incurs.  Kid fires a punch to his grill.  Black guys hit pretty hard (see boxing) and the cop sees red.  Opens fire.  Kid runs. 15 feet is about how far his ass can get before his body reminds his fat ass he is not a sprinter or maybe the shots are starting to set in, now he wants to negotiate.  Cop executes him.  Is it lawful....., maybe, but my story makes more sense.",True,white guy really concerned plight black community doubt spend time hanging around black guy community see world reacts react world time either secondly think anyone even hoped drug charge feeling gunshot first fleeing shooter kind fantasy live must think black shit anything survival mechanism world would police officer right thing give u comfort life want believe cop story another story cop get start cop harassment type antic cop kid give year old fat fuck think whip everybodys as sas hit kid door dumb as kid instead passing getting officer fired paid dollar injury push door back officer grab neck scuffle incurs kid fire punch grill black guy hit pretty hard see boxing cop see red open fire kid run foot far as get body reminds fat as sprinter maybe shot starting set want negotiate cop executes lawful maybe story make sense
UgiIR4s7rz-Wr3gCoAEC,9pr1oE34bIM,"I think my chief problem with Molyneux is that he has great ideals and solid, worthwhile goals that he hopes to share with society, but can't seem to embrace the ethical grey-ness of human beings. He frustrates me with his ""all or nothing"" approach to morality, and as such I don't believe he is worth listening to as a political strategist (which requires recognizing the conditional-nature of human psychology and constructing systemic guides to help incentivize positive culture). Good philosophy, crappy political theory.",False,think chief problem molyneux great ideal solid worthwhile goal hope share society cant seem embrace ethical greyness human being frustrates nothing approach morality dont believe worth listening political strategist requires recognizing conditionalnature human psychology constructing systemic guide help incentivize positive culture good philosophy crappy political theory
UgiixDwSB5aUdXgCoAEC,9pr1oE34bIM,"So sad, he looked like such a nice young man",False,sad looked like nice young man
Ugij7I2Fqtdb8HgCoAEC,9pr1oE34bIM,"I believe in those photos the gentle giant and his accomplice are giving gang signs, no? Even if Brown did raise his hands in surrender, maybe he realized he'd blown it, could get in trouble, and by then Officer Wilson's adrenaline was running high and reacted. Officers don't hesitate or they'd lose their lives. Lord knows there's no such thing as a thug that goes to college? Look at all those angelic professional athletes that keep getting arrested. What crap we're being fed. I'm disgusted.",True,believe photo gentle giant accomplice giving gang sign even brown raise hand surrender maybe realized hed blown could get trouble officer wilson adrenaline running high reacted officer dont hesitate theyd lose life lord know there thing thug go college look angelic professional athlete keep getting arrested crap fed im disgusted
UgiK2ifbuOZWJngCoAEC,9pr1oE34bIM,I can't tell if this is a racist cop or a dumb guy messing with cops. I hate that they make Michael brown seem like a holy man and he is not but that does not make it right to kill him. It's so confusing.,False,cant tell racist cop dumb guy messing cop hate make michael brown seem like holy man make right kill confusing
UgikjrljA1NcWXgCoAEC,9pr1oE34bIM,Thank you +Stefan Molyneux  for sharing your logical and rational evaluation of the occurrences of this incident.,False,thank stefan molyneux sharing logical rational evaluation occurrence incident
UgiktGvDhtO6YngCoAEC,9pr1oE34bIM,Apparently Stefan never read What's the Matter With Kansas,False,apparently stefan never read whats matter kansa
UgiLkxNi2d8b8XgCoAEC,9pr1oE34bIM,This jerk just made up a b.s. story about skittles and Arizona ice tea being components of lean. Which is actual  promethazine a pharmaceutical drug and a easy on to get on the street level. This guy is a quake and for you antebellum period dreamers for negro should live beneath you need to realize that your really not much better off. Statistics would say that there more whites on well fair and more whites committ more violent crimes than anyone. So pls come with more white savior b.s.,False,jerk made b story skittle arizona ice tea component lean actual promethazine pharmaceutical drug easy get street level guy quake antebellum period dreamer negro live beneath need realize really much better statistic would say white well fair white committ violent crime anyone pls come white savior b
UgilnAyNgOEiCngCoAEC,9pr1oE34bIM,"Thank you Stefan, well put",False,thank stefan well put
UgiLoDtsZBccZXgCoAEC,9pr1oE34bIM,"How da Fuck do this gay ass bald white frenchy nigga gonna set hisself up as a dang judge a this whole criminal conspiracy. Micheal brown had his MOTHAFUCKIN HANDS IN THE AIR SON! If u so smart then u should know that when a nigga has his hands in the mothafuckin air that's a sign SHOWIN HE WAS INNOCENT OF THA CRIME!  Sorry for the cussin, but that shit be internationally recognized as an indication of INNOCENCE ON THE PART OF THE PERPETRATOR!  What y'all niggas in the media have here is a plain old fashioned example a MURDER IN THE FIRST DEGREE on the part a Mr. Officer Darren Wilson, for takin the life a this nigga, who was a COLLEGE STUDENT!  Niggas at kent state be protestin , they get they asses shot, and it's a historic event.... Michael brown shot dead in the street while he takin part in the ferguson protests, and y'all media mothafuckas try to explain it away",True,da fuck gay as bald white frenchy nigga gonna set hisself dang judge whole criminal conspiracy micheal brown mothafuckin hand air son u smart u know nigga hand mothafuckin air thats sign showin innocent tha crime sorry cussin shit internationally recognized indication innocence part perpetrator yall nigga medium plain old fashioned example murder first degree part mr officer darren wilson takin life nigga college student nigga kent state protestin get ass shot historic event michael brown shot dead street takin part ferguson protest yall medium mothafuckas try explain away
UgilrITkmW-kdXgCoAEC,9pr1oE34bIM,Why didn't they interview the constitution workers??? Who where caught on tape saying why did u shot he had his hands up,False,didnt interview constitution worker caught tape saying u shot hand
UgilSzQ81KO3zngCoAEC,9pr1oE34bIM,Who is going to pay the store owner for the cigars Big Gigantic Mike stole?,False,going pay store owner cigar big gigantic mike stole
UginHSF2kYVug3gCoAEC,9pr1oE34bIM,Ireland v England Riots 1995 (HQ),False,ireland v england riot hq
UginHWHzGxklGngCoAEC,9pr1oE34bIM,THANK YOU! right on.black people are going to vote 100% democrat this year.thats what all of this race baiting is all about.democrats are rallying their base.smh,False,thank right onblack people going vote democrat yearthats race baiting aboutdemocrats rallying basesmh
Ugio2mAeQzK4z3gCoAEC,9pr1oE34bIM,Wow  common sense in 20014 How refreshing ..... great job Stefan Molyneux,False,wow common sense refreshing great job stefan molyneux
Ugip4rzYRwkfT3gCoAEC,9pr1oE34bIM,why do you focus on how he rolls his blunt?  MJ is not the cause.  It just so happens to be that much like non criminal types the criminal types also smoke pot.  Pot has absolutely nothing to do with any of this.  The fact that he was walking and not driving is more important.  why bring pot into this as some relative intel?  yes criminals have a tendency to smoke pot.  criminals also tend to smoke cigarettes or drink. ,False,focus roll blunt mj cause happens much like non criminal type criminal type also smoke pot pot absolutely nothing fact walking driving important bring pot relative intel yes criminal tendency smoke pot criminal also tend smoke cigarette drink
UgipNLxmdYq6C3gCoAEC,9pr1oE34bIM,That is the best opinion yet. I definitely would of used deadly force myself against someone charging at me after assaulting me prior to that. I carry a gun everywhere I go cause this world is getting crazy.  Thanks for that I'm sharing to everyone I know.,False,best opinion yet definitely would used deadly force someone charging assaulting prior carry gun everywhere go cause world getting crazy thanks im sharing everyone know
Ugipy41Yu1w1DHgCoAEC,9pr1oE34bIM,"I wonder how you would twist Slavery.....The Truth about 400 years of slavery, you are so one sided, I bet that FOX NEWS pay you off the record",False,wonder would twist slaverythe truth year slavery one sided bet fox news pay record
Ugiq0SQkpRsy9HgCoAEC,9pr1oE34bIM,wtf,False,wtf
UgiQ6rR8-yyLZHgCoAEC,9pr1oE34bIM,this comment has nothing to do with the topic of this video...but will someone please set Stefan's rapping to an actual beat. It would be epic.,False,comment nothing topic videobut someone please set stefans rapping actual beat would epic
UgiQjn-ai72EUXgCoAEC,9pr1oE34bIM,This is so far off base that you can't even call it propaganda! BS!,True,far base cant even call propaganda b
Ugiqp9Y1iGeKg3gCoAEC,9pr1oE34bIM,"It looks like M. Brown did the ""suicide"" by cop thing.",True,look like brown suicide cop thing
UgiqSR-xtx2Xd3gCoAEC,9pr1oE34bIM,518 urban youth couldn't handle the truth presented in this video.,False,urban youth couldnt handle truth presented video
Ugir5Lgl83aXSXgCoAEC,9pr1oE34bIM,This is yet another reason why police need to wear A/V recording devices All the time.  And people should as well.  It really helps to ensure Truth is maintained at all times.  I can only imagine what the officers POV camera would show in this situation...,False,yet another reason police need wear av recording device time people well really help ensure truth maintained time imagine officer pov camera would show situation
UgiRdlTIK793_ngCoAEC,9pr1oE34bIM,"all police officers should be wearing a camera on their lapel, all these issues would be open and shut cases...",False,police officer wearing camera lapel issue would open shut case
UgisJqoRxSeFn3gCoAEC,9pr1oE34bIM,"Stefan Molyneux : You did not give a rounded view at all. You simply wanted to use the same old tired ploy of discrediting Michael Brown. No sane person would believe that Officer Wilson is some perfect angelic white man ( no such person exists )we are not privy to any questionable characteristics of this cop and rest assure there are some it is human nature. In spite of Brown smoking weed or stealing blunts or even rapping about bitches , guns etc.. this does not justify someone unarmed being shot that many times. That is the  desensitized culture of hip hop which white people have also monetarily benefited from.",False,stefan molyneux give rounded view simply wanted use old tired ploy discrediting michael brown sane person would believe officer wilson perfect angelic white man person exists privy questionable characteristic cop rest assure human nature spite brown smoking weed stealing blunts even rapping bitch gun etc justify someone unarmed shot many time desensitized culture hip hop white people also monetarily benefited
UgisoZHcRm6m4HgCoAEC,9pr1oE34bIM,"What you were saying at 13 minutes... could easily be a rap about call of duty. White kids play that too. 

Btw pretty sure eminem sums up whites in his lyrics. Go racism!",False,saying minute could easily rap call duty white kid play btw pretty sure eminem sum white lyric go racism
UgisyW8IEanOC3gCoAEC,9pr1oE34bIM,"Dude someone, please tell this dude that listen to violent music like gangsta rap or deathmetal, doesn't mean they like fighting or killing, lol.",False,dude someone please tell dude listen violent music like gangsta rap deathmetal doesnt mean like fighting killing lol
UgitgYg2JEb-VHgCoAEC,9pr1oE34bIM,Denny was brained also with a fire extinguisher.,False,denny brained also fire extinguisher
UgiTynItZhDJ4XgCoAEC,9pr1oE34bIM,"I can't believe you are reciting the music he listened to. What does that have to do with a cop using excessive force. When cops can become judge, jury and executioner we as a society are screwed. The issue is cops that do not get trained on escalation of force and do not use or have non lethal means to apprehend civilian suspects.",False,cant believe reciting music listened cop using excessive force cop become judge jury executioner society screwed issue cop get trained escalation force use non lethal mean apprehend civilian suspect
Ugiu2PRygbRe1XgCoAEC,9pr1oE34bIM,Let it not be news,False,let news
UgiuUjW7qzXNJ3gCoAEC,9pr1oE34bIM,"If you act like a gentleman, you'll be treated like a gentleman.
................someone did not act like a gentleman.  ",False,act like gentleman youll treated like gentleman someone act like gentleman
UgiuVO5vj4mlBHgCoAEC,9pr1oE34bIM,"There's so much good data here.

I wish it was presented without all the speculation about the marijuana blunts, and emphasis on the rap lyrics and youtube videos. I know a few friends who couldn't ever hurt anyone who are guilty of the same.  We all saw the video, we all saw him take the cigars and shove the guy out of his way. There's no reason to try to bring up culturally normative things, which are admittedly ridiculous, but do not indicate actual violence, including rap lyrics which are most often complete bull, when you've otherwise done such an amazing job of collecting a wide range of facts and putting together a, generally, great presentation. 

Again, Thank you for 99% of this, I greatly appreciate it. I just fear that so much of the good material will be dismissed due to your emphasis on these items which you yourself admit really don't mean anything at all. ",False,there much good data wish presented without speculation marijuana blunts emphasis rap lyric youtube video know friend couldnt ever hurt anyone guilty saw video saw take cigar shove guy way there reason try bring culturally normative thing admittedly ridiculous indicate actual violence including rap lyric often complete bull youve otherwise done amazing job collecting wide range fact putting together generally great presentation thank greatly appreciate fear much good material dismissed due emphasis item admit really dont mean anything
UgiUX2v7ObTI5ngCoAEC,9pr1oE34bIM,"All these people with cell phones in the crowd recording the encounter, claiming they saw it all, but nobody - the media, independent researcher or witnesses have video footage of the encounter between Brown and the officer before he was shot.",False,people cell phone crowd recording encounter claiming saw nobody medium independent researcher witness video footage encounter brown officer shot
